{"$schema": "http://json-schema.org/schema#", "type": "object", "properties": {"kind": {"type": "string"}, "etag": {"type": "string"}, "pageInfo": {"type": "object", "properties": {"totalResults": {"type": "integer"}, "resultsPerPage": {"type": "integer"}}, "required": ["resultsPerPage", "totalResults"]}, "items": {"type": "array", "items": {"type": "object", "properties": {"kind": {"type": "string"}, "etag": {"type": "string"}, "id": {"type": "string"}, "snippet": {"type": "object", "properties": {"title": {"type": "string"}, "description": {"type": "string"}, "customUrl": {"type": "string"}, "publishedAt": {"type": "string", "format": "date-time"}, "thumbnails": {"type": "object", "properties": {"default": {"type": "object", "properties": {"url": {"type": "string"}, "width": {"type": "integer"}, "height": {"type": "integer"}}, "required": ["height", "url", "width"]}, "medium": {"type": "object", "properties": {"url": {"type": "string"}, "width": {"type": "integer"}, "height": {"type": "integer"}}, "required": ["height", "url", "width"]}, "high": {"type": "object", "properties": {"url": {"type": "string"}, "width": {"type": "integer"}, "height": {"type": "integer"}}, "required": ["height", "url", "width"]}}, "required": ["default", "high", "medium"]}, "localized": {"type": "object", "properties": {"title": {"type": "string"}, "description": {"type": "string"}}, "required": ["description", "title"]}, "country": {"type": "string"}, "defaultLanguage": {"type": "string"}}, "required": ["description", "localized", "publishedAt", "thumbnails", "title"]}, "contentDetails": {"type": "object", "properties": {"relatedPlaylists": {"type": "object", "properties": {"likes": {"type": "string"}, "uploads": {"type": "string"}}, "required": ["likes", "uploads"]}}, "required": ["relatedPlaylists"]}, "statistics": {"type": "object", "properties": {"viewCount": {"type": "string"}, "subscriberCount": {"type": "string"}, "hiddenSubscriberCount": {"type": "boolean"}, "videoCount": {"type": "string"}}, "required": ["hiddenSubscriberCount", "subscriberCount", "videoCount", "viewCount"]}, "status": {"type": "object", "properties": {"privacyStatus": {"type": "string"}, "isLinked": {"type": "boolean"}, "longUploadsStatus": {"type": "string"}, "madeForKids": {"type": "boolean"}}, "required": ["isLinked", "longUploadsStatus", "privacyStatus"]}, "brandingSettings": {"type": "object", "properties": {"channel": {"type": "object", "properties": {"title": {"type": "string"}, "keywords": {"type": "string"}, "unsubscribedTrailer": {"type": "string"}, "country": {"type": "string"}, "description": {"type": "string"}, "defaultLanguage": {"type": "string"}}, "required": ["title"]}, "image": {"type": "object", "properties": {"bannerExternalUrl": {"type": "string"}}, "required": ["bannerExternalUrl"]}}, "required": ["channel"]}, "contentOwnerDetails": {"type": "object"}, "topicDetails": {"type": "object", "properties": {"topicIds": {"type": "array", "items": {"type": "string"}}, "topicCategories": {"type": "array", "items": {"type": "string"}}}, "required": ["topicCategories", "topicIds"]}, "localizations": {"type": "object", "properties": {"ne": {"type": "object", "properties": {"title": {"type": "string"}, "description": {"type": "string"}}, "required": ["title"]}, "bn": {"type": "object", "properties": {"title": {"type": "string"}, "description": {"type": "string"}}, "required": ["title"]}, "hy": {"type": "object", "properties": {"title": {"type": "string"}, "description": {"type": "string"}}, "required": ["description", "title"]}, "ru": {"type": "object", "properties": {"title": {"type": "string"}, "description": {"type": "string"}}, "required": ["description", "title"]}, "es-US": {"type": "object", "properties": {"title": {"type": "string"}, "description": {"type": "string"}}, "required": ["title"]}, "hr": {"type": "object", "properties": {"title": {"type": "string"}, "description": {"type": "string"}}, "required": ["description", "title"]}, "hi": {"type": "object", "properties": {"title": {"type": "string"}, "description": {"type": "string"}}, "required": ["title"]}, "pa": {"type": "object", "properties": {"title": {"type": "string"}, "description": {"type": "string"}}, "required": ["title"]}, "en-IN": {"type": "object", "properties": {"title": {"type": "string"}, "description": {"type": "string"}}, "required": ["title"]}, "eu": {"type": "object", "properties": {"title": {"type": "string"}, "description": {"type": "string"}}, "required": ["description", "title"]}, "pt-PT": {"type": "object", "properties": {"title": {"type": "string"}, "description": {"type": "string"}}, "required": ["title"]}, "hu": {"type": "object", "properties": {"title": {"type": "string"}, "description": {"type": "string"}}, "required": ["description", "title"]}, "sk": {"type": "object", "properties": {"title": {"type": "string"}, "description": {"type": "string"}}, "required": ["title"]}, "ta": {"type": "object", "properties": {"title": {"type": "string"}, "description": {"type": "string"}}, "required": ["title"]}, "lo": {"type": "object", "properties": {"title": {"type": "string"}, "description": {"type": "string"}}, "required": ["title"]}, "sq": {"type": "object", "properties": {"title": {"type": "string"}, "description": {"type": "string"}}, "required": ["title"]}, "ja": {"type": "object", "properties": {"title": {"type": "string"}, "description": {"type": "string"}}, "required": ["title"]}, "km": {"type": "object", "properties": {"title": {"type": "string"}, "description": {"type": "string"}}, "required": ["title"]}, "af": {"type": "object", "properties": {"title": {"type": "string"}, "description": {"type": "string"}}, "required": ["title"]}, "es": {"type": "object", "properties": {"title": {"type": "string"}, "description": {"type": "string"}}, "required": ["description", "title"]}, "ur": {"type": "object", "properties": {"title": {"type": "string"}, "description": {"type": "string"}}, "required": ["title"]}, "et": {"type": "object", "properties": {"title": {"type": "string"}, "description": {"type": "string"}}, "required": ["title"]}, "iw": {"type": "object", "properties": {"title": {"type": "string"}, "description": {"type": "string"}}, "required": ["description", "title"]}, "sr": {"type": "object", "properties": {"title": {"type": "string"}, "description": {"type": "string"}}, "required": ["description", "title"]}, "fi": {"type": "object", "properties": {"title": {"type": "string"}, "description": {"type": "string"}}, "required": ["description", "title"]}, "da": {"type": "object", "properties": {"title": {"type": "string"}, "description": {"type": "string"}}, "required": ["description", "title"]}, "zh-TW": {"type": "object", "properties": {"title": {"type": "string"}, "description": {"type": "string"}}, "required": ["description", "title"]}, "de": {"type": "object", "properties": {"title": {"type": "string"}, "description": {"type": "string"}}, "required": ["description", "title"]}, "cs": {"type": "object", "properties": {"title": {"type": "string"}, "description": {"type": "string"}}, "required": ["description", "title"]}, "bs": {"type": "object", "properties": {"title": {"type": "string"}, "description": {"type": "string"}}, "required": ["title"]}, "as": {"type": "object", "properties": {"title": {"type": "string"}, "description": {"type": "string"}}, "required": ["title"]}, "my": {"type": "object", "properties": {"title": {"type": "string"}, "description": {"type": "string"}}, "required": ["title"]}, "sl": {"type": "object", "properties": {"title": {"type": "string"}, "description": {"type": "string"}}, "required": ["title"]}, "it": {"type": "object", "properties": {"title": {"type": "string"}, "description": {"type": "string"}}, "required": ["description", "title"]}, "id": {"type": "object", "properties": {"title": {"type": "string"}, "description": {"type": "string"}}, "required": ["description", "title"]}, "be": {"type": "object", "properties": {"title": {"type": "string"}, "description": {"type": "string"}}, "required": ["title"]}, "pl": {"type": "object", "properties": {"title": {"type": "string"}, "description": {"type": "string"}}, "required": ["description", "title"]}, "en-GB": {"type": "object", "properties": {"title": {"type": "string"}, "description": {"type": "string"}}, "required": ["title"]}, "zh-HK": {"type": "object", "properties": {"title": {"type": "string"}, "description": {"type": "string"}}, "required": ["title"]}, "th": {"type": "object", "properties": {"title": {"type": "string"}, "description": {"type": "string"}}, "required": ["title"]}, "is": {"type": "object", "properties": {"title": {"type": "string"}, "description": {"type": "string"}}, "required": ["description", "title"]}, "fr": {"type": "object", "properties": {"title": {"type": "string"}, "description": {"type": "string"}}, "required": ["description", "title"]}, "ro": {"type": "object", "properties": {"title": {"type": "string"}, "description": {"type": "string"}}, "required": ["title"]}, "am": {"type": "object", "properties": {"title": {"type": "string"}, "description": {"type": "string"}}, "required": ["title"]}, "no": {"type": "object", "properties": {"title": {"type": "string"}, "description": {"type": "string"}}, "required": ["description", "title"]}, "en": {"type": "object", "properties": {"title": {"type": "string"}, "description": {"type": "string"}}, "required": ["title"]}, "fil": {"type": "object", "properties": {"title": {"type": "string"}, "description": {"type": "string"}}, "required": ["title"]}, "nl": {"type": "object", "properties": {"title": {"type": "string"}, "description": {"type": "string"}}, "required": ["description", "title"]}, "fa": {"type": "object", "properties": {"title": {"type": "string"}, "description": {"type": "string"}}, "required": ["description", "title"]}, "bg": {"type": "object", "properties": {"title": {"type": "string"}, "description": {"type": "string"}}, "required": ["description", "title"]}, "sr-Latn": {"type": "object", "properties": {"title": {"type": "string"}, "description": {"type": "string"}}, "required": ["title"]}, "mn": {"type": "object", "properties": {"title": {"type": "string"}, "description": {"type": "string"}}, "required": ["description", "title"]}, "az": {"type": "object", "properties": {"title": {"type": "string"}, "description": {"type": "string"}}, "required": ["title"]}, "kn": {"type": "object", "properties": {"title": {"type": "string"}, "description": {"type": "string"}}, "required": ["title"]}, "pt": {"type": "object", "properties": {"title": {"type": "string"}, "description": {"type": "string"}}, "required": ["description", "title"]}, "sw": {"type": "object", "properties": {"title": {"type": "string"}, "description": {"type": "string"}}, "required": ["title"]}, "tr": {"type": "object", "properties": {"title": {"type": "string"}, "description": {"type": "string"}}, "required": ["description", "title"]}, "sv": {"type": "object", "properties": {"title": {"type": "string"}, "description": {"type": "string"}}, "required": ["description", "title"]}, "ca": {"type": "object", "properties": {"title": {"type": "string"}, "description": {"type": "string"}}, "required": ["description", "title"]}, "ko": {"type": "object", "properties": {"title": {"type": "string"}, "description": {"type": "string"}}, "required": ["description", "title"]}, "or": {"type": "object", "properties": {"title": {"type": "string"}, "description": {"type": "string"}}, "required": ["title"]}, "ml": {"type": "object", "properties": {"title": {"type": "string"}, "description": {"type": "string"}}, "required": ["title"]}, "zh-CN": {"type": "object", "properties": {"title": {"type": "string"}, "description": {"type": "string"}}, "required": ["title"]}, "mr": {"type": "object", "properties": {"title": {"type": "string"}, "description": {"type": "string"}}, "required": ["title"]}, "ky": {"type": "object", "properties": {"title": {"type": "string"}, "description": {"type": "string"}}, "required": ["title"]}, "zu": {"type": "object", "properties": {"title": {"type": "string"}, "description": {"type": "string"}}, "required": ["title"]}, "fr-CA": {"type": "object", "properties": {"title": {"type": "string"}, "description": {"type": "string"}}, "required": ["title"]}, "es-419": {"type": "object", "properties": {"title": {"type": "string"}, "description": {"type": "string"}}, "required": ["title"]}, "si": {"type": "object", "properties": {"title": {"type": "string"}, "description": {"type": "string"}}, "required": ["title"]}, "ka": {"type": "object", "properties": {"title": {"type": "string"}, "description": {"type": "string"}}, "required": ["title"]}, "gu": {"type": "object", "properties": {"title": {"type": "string"}, "description": {"type": "string"}}, "required": ["title"]}, "ar": {"type": "object", "properties": {"title": {"type": "string"}, "description": {"type": "string"}}, "required": ["description", "title"]}, "gl": {"type": "object", "properties": {"title": {"type": "string"}, "description": {"type": "string"}}, "required": ["title"]}, "vi": {"type": "object", "properties": {"title": {"type": "string"}, "description": {"type": "string"}}, "required": ["title"]}, "uk": {"type": "object", "properties": {"title": {"type": "string"}, "description": {"type": "string"}}, "required": ["description", "title"]}, "lv": {"type": "object", "properties": {"title": {"type": "string"}, "description": {"type": "string"}}, "required": ["title"]}, "mk": {"type": "object", "properties": {"title": {"type": "string"}, "description": {"type": "string"}}, "required": ["title"]}, "kk": {"type": "object", "properties": {"title": {"type": "string"}, "description": {"type": "string"}}, "required": ["title"]}, "ms": {"type": "object", "properties": {"title": {"type": "string"}, "description": {"type": "string"}}, "required": ["description", "title"]}, "lt": {"type": "object", "properties": {"title": {"type": "string"}, "description": {"type": "string"}}, "required": ["title"]}, "te": {"type": "object", "properties": {"title": {"type": "string"}, "description": {"type": "string"}}, "required": ["title"]}, "el": {"type": "object", "properties": {"title": {"type": "string"}, "description": {"type": "string"}}, "required": ["title"]}, "uz": {"type": "object", "properties": {"title": {"type": "string"}, "description": {"type": "string"}}, "required": ["title"]}, "zh": {"type": "object", "properties": {"description": {"type": "string"}}, "required": ["description"]}, "pt-BR": {"type": "object", "properties": {"title": {"type": "string"}, "description": {"type": "string"}}, "required": ["title"]}, "en_US": {"type": "object", "properties": {"title": {"type": "string"}, "description": {"type": "string"}}, "required": ["description", "title"]}}}}, "required": ["brandingSettings", "contentDetails", "contentOwnerDetails", "etag", "id", "kind", "snippet", "statistics", "status"]}}}, "required": ["etag", "kind", "pageInfo"]}
