{
  "kind": "youtube#channelListResponse",
  "etag": "GXGhClscuXS4LYwcSBTU7p1pHlw",
  "pageInfo": {
    "totalResults": 1,
    "resultsPerPage": 5
  },
  "items": [
    {
      "kind": "youtube#channel",
      "etag": "GaAZUP5nUdxwknGHVmf_UKyMzq0",
      "id": "UC4QobU6STFB0P71PMvOGN5A",
      "snippet": {
        "title": "jawed",
        "description": "",
        "customUrl": "@jawed",
        "publishedAt": "2005-04-24T03:20:54Z",
        "thumbnails": {
          "default": {
            "url": "https://yt3.ggpht.com/uI3VE4PVqvCy0xnWLqMJnEzyBUm3T8VHOCp4ee-1RxdHqKXCdUE_qXYQnpf9AfuEoIPactVyDhM=s88-c-k-c0x00ffffff-no-rj",
            "width": 88,
            "height": 88
          },
          "medium": {
            "url": "https://yt3.ggpht.com/uI3VE4PVqvCy0xnWLqMJnEzyBUm3T8VHOCp4ee-1RxdHqKXCdUE_qXYQnpf9AfuEoIPactVyDhM=s240-c-k-c0x00ffffff-no-rj",
            "width": 240,
            "height": 240
          },
          "high": {
            "url": "https://yt3.ggpht.com/uI3VE4PVqvCy0xnWLqMJnEzyBUm3T8VHOCp4ee-1RxdHqKXCdUE_qXYQnpf9AfuEoIPactVyDhM=s800-c-k-c0x00ffffff-no-rj",
            "width": 800,
            "height": 800
          }
        },
        "localized": {
          "title": "jawed",
          "description": ""
        },
        "country": "US"
      },
      "contentDetails": {
        "relatedPlaylists": {
          "likes": "",
          "uploads": "UU4QobU6STFB0P71PMvOGN5A"
        }
      },
      "statistics": {
        "viewCount": "405753898",
        "subscriberCount": "6430000",
        "hiddenSubscriberCount": false,
        "videoCount": "1"
      },
      "status": {
        "privacyStatus": "public",
        "isLinked": true,
        "longUploadsStatus": "longUploadsUnspecified",
        "madeForKids": false
      },
      "brandingSettings": {
        "channel": {
          "title": "jawed",
          "keywords": "\"me at the zoo\" \"jawed karim\" \"first youtube video\"",
          "unsubscribedTrailer": "jNQXAC9IVRw",
          "country": "US"
        },
        "image": {
          "bannerExternalUrl": "https://yt3.googleusercontent.com/9oxdo7zGCuEofTfnBIuUAf7B0ynncs-aQmgx9lXQ33VRwrJyQlHmYpH6wfczKgGYfVThQ31dhg"
        }
      },
      "contentOwnerDetails": {}
    }
  ]
}
