{
  "kind": "youtube#channelListResponse",
  "etag": "mLRtk7Vq6DLxNhbZb7gWuWHoUtQ",
  "pageInfo": {
    "totalResults": 1,
    "resultsPerPage": 5
  },
  "items": [
    {
      "kind": "youtube#channel",
      "etag": "Isj8oI6j8iocIXWJ_ZRS_V2Qboo",
      "id": "UCgoFStVyEsm8tBZP5NC-aBQ",
      "snippet": {
        "title": "MrBeast",
        "description": "",
        "customUrl": "@user-uv1rl3kz5x",
        "publishedAt": "2006-03-11T18:48:11Z",
        "thumbnails": {
          "default": {
            "url": "https://yt3.ggpht.com/ytc/AIdro_n3Ch8N2rxItVnYnvvZ43mSsKzCIJ2LsYFEcn__vgelkVY=s88-c-k-c0x00ffffff-no-rj",
            "width": 88,
            "height": 88
          },
          "medium": {
            "url": "https://yt3.ggpht.com/ytc/AIdro_n3Ch8N2rxItVnYnvvZ43mSsKzCIJ2LsYFEcn__vgelkVY=s240-c-k-c0x00ffffff-no-rj",
            "width": 240,
            "height": 240
          },
          "high": {
            "url": "https://yt3.ggpht.com/ytc/AIdro_n3Ch8N2rxItVnYnvvZ43mSsKzCIJ2LsYFEcn__vgelkVY=s800-c-k-c0x00ffffff-no-rj",
            "width": 800,
            "height": 800
          }
        },
        "localized": {
          "title": "MrBeast",
          "description": ""
        }
      },
      "contentDetails": {
        "relatedPlaylists": {
          "likes": "",
          "uploads": "UUgoFStVyEsm8tBZP5NC-aBQ"
        }
      },
      "statistics": {
        "viewCount": "78232",
        "subscriberCount": "2090",
        "hiddenSubscriberCount": false,
        "videoCount": "3"
      },
      "topicDetails": {
        "topicIds": [
          "/m/02ntfj",
          "/m/0bzvm2",
          "/m/0403l3g",
          "/m/025zzc"
        ],
        "topicCategories": [
          "https://en.wikipedia.org/wiki/Action-adventure_game",
          "https://en.wikipedia.org/wiki/Video_game_culture",
          "https://en.wikipedia.org/wiki/Role-playing_video_game",
          "https://en.wikipedia.org/wiki/Action_game"
        ]
      },
      "status": {
        "privacyStatus": "public",
        "isLinked": true,
        "longUploadsStatus": "longUploadsUnspecified"
      },
      "brandingSettings": {
        "channel": {
          "title": "MrBeast"
        }
      },
      "contentOwnerDetails": {}
    }
  ]
}